,Name,activity_type,ratings,address,website,contact,Open/Closed,Time
0,Prithvi Cafe,Cafe, 4.4 stars ,"20, Janki Kutir Apartment, Alongside Prithvi Theatre, Juhu Church Rd, Mumbai, Maharashtra 400049",['swiggy.com'],070459 40218,Open, ⋅ Closes 10:30 pm
1,Boojee Cafe,Cafe, 4.6 stars ,"Shop No 6, New kantwadi, Off, Perry Cross Rd, Bandra West, Mumbai, Maharashtra 400050","['thrivenow.in', 'thrivenow.in']",099302 03882,Open, ⋅ Closes 10:30 pm
2,Kala Ghoda Cafe,Cafe, 4.4 stars ,"10, Rope Walk Ln, Kala Ghoda, Fort, Mumbai, Maharashtra 400001","['kalaghodacafe.petpooja.com', 'kgcafe.in']",098338 03418,Unavailable,Unavailable
3,Leaping Windows,Coffee shop, 4.6 stars ,"Corner View, 3, Dr.Ashok Chopra Marg, Opp. Bianca Towers, Amit Nagar, Versova, Andheri West, Mumbai, Maharashtra 400061","['swiggy.com', 'leapingwindows.com']",097699 98972,Closed, ⋅ Opens 12 pm
4,Cococart & CocoCafe,Cafe, 4.4 stars ,"Jiji House, Raveline Street Damodar Sukhadwala Marg, 17, D Sukhadwala Rd, Azad Maidan, Fort, Mumbai, Maharashtra 400001","['dineout.co.in', 'swiggy.com', 'cococart.in']",072088 26812,Open, ⋅ Closes 11 pm
5,Cafe Reed Mumbai,Cafe, 4.7 stars ,"8th Floor, Tower 2A, One World Center, Lower Parel, Mumbai, Maharashtra 400013",[],072088 26812,Unavailable,Unavailable
6,The Hastrm Cafe,Cafe, 5.0 stars ,"Opposit Dmart ready, Shop no:7,Idgah road,near wadia school, Andheri West, Mumbai, Maharashtra 400053",['swiggy.com'],073046 67487,Open, ⋅ Closes 10 pm
7,Earth Cafe @ Waterfield,Cafe, 4.6 stars ,"Durga Chambers, Waterfield Road, above Pernia's Pop Up MEN, Bandra West, Mumbai, Maharashtra 400050","['eazydiner.com', 'swiggy.com', 'zomato.com', 'earthcafeindia.com']",098198 28989,Open, ⋅ Closes 11 pm
8,"Grandmama's Cafe, Dadar East",Cafe, 4.2 stars ,"Dharamputra Pritam Estate, 20 & 21, Dr Baba Saheb Ambedkar Rd, Dadar East, Dadar, Mumbai, Maharashtra 400014","['dineout.co.in', 'grandmamascafe.com']",085910 75473,Closed, ⋅ Opens 12 pm
9,Garde Manger Cafe and BAKERY,Health food restaurant, 4.3 stars ,"Shop No 1 , Parmar Housing Society Paranjape B Scheme, Rd Number 1, beside Natural Ice Cream, Vile Parle East, Mumbai, Maharashtra 400057","['swiggy.com', 'zomato.com', 'instagram.com']",070450 04488,Unavailable,Unavailable
10,Leopold Cafe,Cafe, 4.2 stars ,"Police Station, Shahid Bhagat Singh Road, Colaba Causeway, near Colaba, Mumbai, Maharashtra 400001","['dineout.co.in', 'swiggy.com']",070450 04488,Open, ⋅ Closes 12 am
11,Cafe Universal,Cafe, 4.2 stars ,"299, Shahid Bhagat Singh Rd, opp. Geo Chem Laboratories, Ballard Estate, Fort, Mumbai, Maharashtra 400001",['swiggy.com'],070450 04488,Open, ⋅ Closes 11 pm
12,Pachinco - Cafe & More,Cafe, 4.4 stars ,"Ground Floor, Crescent Royale, Veera Desai Road, off link road Behind Crescent Tower, Andheri West, Mumbai, Maharashtra 400053","['dineout.co.in', 'swiggy.com']",088796 45670,Open, ⋅ Closes 11:30 pm
13,Le Cafe,Cafe, 4.4 stars ,"Jewel of chembur, 1st Road, Opp Bmc OFFice, Near Natraj Cinema, Chembur Gaothan, Chembur, Maharashtra 400071","['dineout.co.in', 'zomato.com']",088796 45670,Unavailable,Unavailable
14,Ananda Cafe,Coffee shop, 4.7 stars ,"Shop no 1/2 Avantika CHS Ltd, Birla Ln, Juhu, Mumbai, Maharashtra 400049",['swiggy.com'],093728 28531,Open, ⋅ Closes 10 pm
15,KC ROASTERS By Koinonia,Coffee shop, 4.7 stars ,"6, Chuim Village Rd, Khar, Chuim Village, Danda, Khar West, Mumbai, Maharashtra 400052","['zomato.com', 'kcroasters.com']",091366 50277,Open, ⋅ Closes 10 pm
16,Cafe Kokomo,Cafe, 4.8 stars ,"4, Pratap CHS Limited, Shivaji Road, Bridge, near Vakola, Santacruz East, Mumbai, Maharashtra 400055","['cafekokomo.dotpe.in', 'cafekokomo.net']",085915 15657,Unavailable,Unavailable
17,Café Arpan,Cafe, 4.8 stars ,"Shop No. 20, Juhu Ruturaj CHS Ltd, Juhu Tara Rd, opp. SNDT Womens University, Mumbai, Maharashtra 400049",['thrivenow.in'],074004 90008,Open, ⋅ Closes 8 pm
18,Mag St. Cafe,Cafe, 4.4 stars ,"4, Mandlik Rd, Apollo Bandar, Colaba, Mumbai, Maharashtra 400001","['swiggy.com', 'linktr.ee']",072085 44366,Open, ⋅ Closes 11:30 pm
19,The lil Paris Cafe,Cafe, 4.9 stars ,"Shop No.2, Park Paradise, Opp. Green Park Building, Oshiwara, Andheri West, Mumbai, Maharashtra 400053",[],072085 44366,Open, ⋅ Closes 12 am
20,Cafè Estrella,Cafe, 4.8 stars ,"Itus Dinanath, A1 shop, 4 bunglows, RTO Area, opposite Kokilaben hospital, Andheri West, Mumbai, Maharashtra 400053","['dineout.co.in', 'swiggy.com', 'link.zomato.com']",086571 40721,Closed, ⋅ Opens 12 pm
21,Greenr Cafe,Cafe, 4.5 stars ,"Greenr, 57/116, Drego House, Pali Naka, Dr Ambedkar Rd, Bandra West, Mumbai, Maharashtra 400050","['eazydiner.com', 'greenr.in']",085911 38613,Closed, ⋅ Opens 12:30 pm
22,Zane's Cafe,Cafe, 4.7 stars ,"R R House, Todi Mill Compound, Tulsi Pipe Rd, opposite Ideal Industrial Estate, Lower Parel, Mumbai, Maharashtra 400013","['swiggy.com', 'zomato.com']",098198 20202,Open, ⋅ Closes 12 am
23,Birdsong Organic Cafe,Cafe, 4.2 stars ,"Jenu Jenai, Off. Hill Road, Shop No. 1-5, Waroda Rd, Ranwar, Bandra West, Mumbai, Maharashtra 400050","['eazydiner.com', 'facebook.com']",099876 75188,Open, ⋅ Closes 10 pm
24,Breve Cafe,Cafe, 4.4 stars ,"Shop No.12, Pearl Haven Apartments, Chapel Rd, St Sebastian Colony, Mount Mary, Bandra West, Mumbai, Maharashtra 400050","['eazydiner.com', 'drive.google.com']",090825 87137,Open, ⋅ Closes 12 am
25,Backbenchers Cafeteria,Cafe, 4.7 stars ,"Patel Chowk, R.B. Mehta Marg, Pant Nagar, Near Neelyog Square, Ghatkopar East, Mumbai, Maharashtra 400077",[],097021 30632,Open, ⋅ Closes 11 pm
26,Pali Village Café,Restaurant, 4.4 stars ,"10, Pali Mala Rd, Adarsh Nagar, Bandra West, Mumbai, Maharashtra 400050",['swiggy.com'],097021 30632,Open, ⋅ Closes 12 am
27,Pair A Dice Cafe,Cafe, 4.2 stars ,"1st Floor, Link Plaza Commercial Complex, 53, above Fire Bowl Restaurant, Andheri West, Mumbai, Maharashtra 400102","['dineout.co.in', 'swiggy.com']",097021 30632,Closed, ⋅ Opens 12 pm
28,The Homemade Cafe,Cafe, 4.3 stars ,"Shop No. 4, 41, kaveri Building, Near, Oshiwara Police Station Rd, Anand Nagar, Andheri West, Mumbai, Maharashtra 400102",['swiggy.com'],070458 94299,Closed, ⋅ Opens 12 pm
29,Ohh My Dog Cafe Pefe World's 1st Dog Cafe,Dog cafe, 4.5 stars ,"Pratisthan Bunglow,Yamuna Nagar, Back Road, opp. Fairy Land School, beside RNA Eclat, Lokhandwala Complex, Andheri West, Mumbai, Maharashtra 400053","['swiggy.com', 'cafepefe.com']",070458 94299,Unavailable,Unavailable
30,The C Spot Cafe,Cafe, 4.7 stars ,"Shop No . 3 Vaibhav Palace CHS, New Link Rd, Oshiwara, Andheri West, Mumbai, Maharashtra 400102","['swiggy.com', 'thecspotcafe.com']",070458 94299,Open, ⋅ Closes 1:30 am
31,The Origin Cafe,Coffee shop, 4.9 stars ,"352, Off Linking Rd, Khar, Khar West, Mumbai, Maharashtra 400052","['swiggy.com', 'bawahotels.com', 'bawahotels.com']",085917 20926,Open, ⋅ Closes 10 pm
32,Beat House Cafe,Cafe, 4.2 stars ,"Hotel Sapna Marine,1st, Marine Ln, Dhobi Talao, Marine Lines, Mumbai, Maharashtra 400002",[],085917 20926,Unavailable,Unavailable
33,August Cafe,Cafe, 4.3 stars ,"A-3, Sastri Nagar Rd, Sundervan Complex, Shastri Nagar, Andheri West, Mumbai, Maharashtra 400053","['swiggy.com', 'zomato.com', 'augustcafe.in']",085917 20926,Open, ⋅ Closes 12 am
34,Aromas Café & Bistro,Cafe, 4.2 stars ,"Ventura Building, G6, Central Ave, opposite DMart, Hiranandani Gardens, Powai, Mumbai, Maharashtra 400076",['swiggy.com'],082911 66739,Open, ⋅ Closes 12 am
35,Silver Beach Cafe,Cafe, 4.2 stars ,"Jal Darshan Building, 94/6, Shri GB Jukar Marg, beside Juhu Tara, Jukarwadi, Juhu, Mumbai, Maharashtra 400049","['dineout.co.in', 'swiggy.com', 'facebook.com']",082911 66739,Open, ⋅ Closes 12 am
36,Mish Cafe,Coffee shop, 4.9 stars ,"shop no 9, Hinduja College, Mehta bhavan, lane, Raja Ram Mohan Roy Rd, Mumbai, Maharashtra 400004","['swiggy.com', 'drive.google.com']",082911 66739,Closed, ⋅ Opens 12 pm
37,Brakefree Cafe,Cafe, 4.3 stars ,"Title Waves, St Paul Media Complex, ST. PAUL'S INSTITUTE OF COMMUNICATION EDUCATION, Rd Number 24, opp. Duruelo Convent School, Bandra West, Mumbai, Maharashtra 400050","['eazydiner.com', 'swiggy.com', 'brakefree.in']",098197 84963,Open, ⋅ Closes 10 pm
38,JW Cafe,Coffee shop, 4.6 stars ,"Chhatrapati Shivaji International Airport Area, Navpada, Vile Parle East, Vile Parle, Mumbai, Maharashtra 400099","['bit.ly', 'jwmumbai.com']",098197 84963,Open, ⋅ Closes 11:30 pm
39,Pokket Cafe Chowpatty,Cafe, 4.3 stars ,"Shop No 1 & 2, 39/A, N.S Road, below Revival Restaurant, Charni Road East, Sea Face, Chowpatty, Gamdevi, Mumbai, Maharashtra 400007",['dineout.co.in'],091369 66818,Open, ⋅ Closes 11 pm
40,Bake House Cafe,Cafe, 4.3 stars ,"WRHJ+6XF, Chamber of Commerce Ln, Kala Ghoda, Fort, Mumbai, Maharashtra 400001",['swiggy.com'],091369 66818,Open, ⋅ Closes 1 am
41,Chaos Control Cafe,Cafe, 4.3 stars ,"Gr. Floor, Crystal Towers St. Xavier's Street, Parel, Mumbai, Maharashtra 400012","['dineout.co.in', 'swiggy.com']",091678 61373,Open, ⋅ Closes 12 am
42,I CAFE,Cafe, 4.7 stars ,"Ranwar, Bandra West, Mumbai, Maharashtra 400050","['dineout.co.in', 'swiggy.com']",076666 16555,Open, ⋅ Closes 8 pm
43,Cafe Excelsior,Cafe, 4.1 stars ,"Kitab Mahal, 23, AK Nayak Marg, opp. Excelsior Cinema, Azad Maidan, Fort, Mumbai, Maharashtra 400001",['swiggy.com'],076666 16555,Open, ⋅ Closes 9 pm
44,Dilly Dally Cafe,Cafe, 4.5 stars ,"shop no 2/3, Melbourne Building, Shastri Nagar Lane 1, Lokhandwala Complex, Andheri West, Mumbai, Maharashtra 400053","['dillydallycafe.in', 'dillydallycafe.in']",083691 62072,Unavailable,Unavailable
45,Cafe Panama,Cafe, 4.4 stars ,"Lower Parel Compound, Sitaram Jadhav Marg, Lower Parel, Mumbai, Maharashtra 400013",['swiggy.com'],099882 14444,Closed, ⋅ Opens 12 pm
46,Banyan Tree Cafe,Cafe, 4.2 stars ,"7, 9, Calicut Rd, Ballard Estate, Fort, Mumbai, Maharashtra 400001","['eazydiner.com', 'swiggy.com']",096190 33000,Open, ⋅ Closes 9 pm
47,Bombay To Barcelona Library Cafe,Cafe, 4.6 stars ,"Timmy Arcade, 778, Makwana Rd, Gamdevi, Marol, Andheri East, Mumbai, Maharashtra 400059",['bombaytobarcelonalibrarycafe.com'],077384 46788,Open, ⋅ Closes 11 pm
48,Third Wave Coffee,Cafe, 4.9 stars ,"CrossWord Bookstore, Kemps Corner Flyover, Babulnath, Kemps Corner, Tardeo, Mumbai, Maharashtra 400026","['thirdwavecoffee.in', 'swiggy.com', 'cafe.thirdwavecoffee.in']",081477 38399,Open, ⋅ Closes 10 pm
49,The Trans Cafe,Cafe, 4.9 stars ,"Bunglow 30/33, Old, Mhada Rd, opposite Laxmi Dairy, near Hanuman Mandir Lane, SV Patel Nagar, Andheri West, Mumbai, Maharashtra 400053",[],081477 38399,Closed, ⋅ Opens 1 pm
50,Cafe Madras®️,South Indian restaurant, 4.4 stars ,"GROUND FLOOR KAMAKSHI BUILDING, 391/B, Bhaudaji Rd, Matunga East, Mumbai, Maharashtra 400019",[],081477 38399,Open, ⋅ Closes 2:45 pm ⋅ Reopens 4 pm
51,Cafe Irani Chaii,Cafe, 4.4 stars ,"Rosary Building, Mia Mohd Chhotani Rd, Geeta Nagar, Mahim West, Mahim, Mumbai, Maharashtra 400016",['swiggy.com'],098202 85577,Open, ⋅ Closes 11 pm
52,Cafe Irani Chaii,Cafe, 4.4 stars ,"Rosary Building, Mia Mohd Chhotani Rd, Geeta Nagar, Mahim West, Mahim, Mumbai, Maharashtra 400016",['swiggy.com'],098202 85577,Open, ⋅ Closes 11 pm
53,BEST BUDDY'S CAFE,Cafe, 4.2 stars ,"SHOP NO. 1, BUILDING NO. 42, MATRUCHHAY CHSL, Oshiwara Police Station Road, ,Andheri West, Mumbai, Maharashtra 400102",['facebook.com'],098202 85577,Open, ⋅ Closes 12 am
54,Aromas Café & Bistro,Cafe, 4.1 stars ,"Gazebo House, 52, Ground Floor, Gulmohar Rd, below Country Club Fitness, Juhu, Mumbai, Maharashtra 400049","['dineout.co.in', 'swiggy.com']",075067 96262,Open, ⋅ Closes 12 am
55,Ettarra Coffee House,Cafe, 4.7 stars ,"boutique hotel, Ground floor, Juhu residency, Mumbai, Maharashtra 400049",['swiggy.com'],075067 96262,Open, ⋅ Closes 11:30 pm
56,Starbucks Cafe - Coffee Shop in Mumbai,Coffee shop, 4.3 stars ,"Oberoi Mall General AK Vidya Marg, Second floor, Western Express Hwy, Yashodham, Goregaon, Mumbai, Maharashtra 400063",['oberoimall.com'],090290 19072,Open, ⋅ Closes 11 pm
57,AQUA - THE 24-HOUR COFFEE SHOP,Coffee shop, 4.3 stars ,"Sun-N-Sand Hotel, 39, Juhu Beach, Juhu, Mumbai, Maharashtra 400049","['dineout.co.in', 'sunnsandhotel.com']",090290 19072,Unavailable,Open 24 hours
58,KEFI Eatery & Cafe,Cafe, 4.9 stars ,"Shop No. 11, Mayfair Appartments, Sundervan Complex Rd, near Hotel Empressa, Shastri Nagar, Andheri West, Mumbai, Maharashtra 400053","['dineout.co.in', 'swiggy.com']",089761 91699,Unavailable,Unavailable
59,Blue Tokai Coffee Roasters | Bandra,Cafe, 4.4 stars ,"Shop No 1, Mayflower Building, 33, New Kant Wadi Lane, Perry Rd, Bandra West, Mumbai, Maharashtra 400050","['eazydiner.com', 'zomato.com', 'cafe.bluetokaicoffee.com']",090825 66400,Open, ⋅ Closes 9 pm
60,Mumbai Bistro - The Cafe,Cafe, 4.1 stars ,"Shop No.3, Building by, SUGEE SADAN by SUGEE GROUP, Gokhale Rd, Dadar West, Dadar, Mumbai, Maharashtra 400028",['dineout.co.in'],096642 43774,Closed, ⋅ Opens 12 pm
61,Café Condi,Cafe, 4.4 stars ,"14-A, Waroda Rd, Ranwar, Bandra West, Mumbai, Maharashtra 400050","['swiggy.com', 'zomato.com', 'instagram.com']",098701 48816,Open, ⋅ Closes 8 pm
62,Ottoman Cafe,Hookah bar, 4.5 stars ,"Plot no. 18, J.P. Road Opp Sun & Sea Building, Versova, Mumbai, Maharashtra 400061",['dineout.co.in'],091366 48995,Unavailable,Unavailable
63,Farmer cafe,Cafe, 4.3 stars ,"Shop No.1, Celeste Bldg, Plot No. 470, Kinchin CHS, 14th Rd, Khar, Khar West, Mumbai, Maharashtra 400052",[],075060 15930,Open, ⋅ Closes 11 pm
64,Bistro 1 Cafe,Cafe, 4.1 stars ,"4, Mayfair Apartments, Lokhandwala Circle, behind Sab T V - Kalinga Lane, Shastri Nagar, Andheri West, Mumbai, Maharashtra 400053",['swiggy.com'],075060 15930,Open, ⋅ Closes 12 am
65,Cafe Noir,Cafe, 4.4 stars ,"World Crest, Unit no.1A & 1B, Lodha, Upper Worli, Lower Parel, Mumbai, Maharashtra 400013","['swiggy.com', 'cafenoir.in']",074004 91481,Open, ⋅ Closes 11 pm
66,BAMBAI NAZARIYA,Tea house, 4.9 stars ,"Shop no 3, Mayfair Apartments, Lokhandwala Circle, behind Sab T V - Kalinga Lane, Shastri Nagar, Andheri West, Mumbai, Maharashtra 400053",['swiggy.com'],096197 31050,Unavailable,Unavailable
67,Bayleaf Cafe,Restaurant, 4.6 stars ,"32, Juhu Church Rd, Janki Kutir, Juhu Tara, Juhu, Mumbai, Maharashtra 400049","['bayleafcafe.in', 'swiggy.com', 'bayleafcafe.in', 'bayleafcafe.in']",084549 44954,Open, ⋅ Closes 11:30 pm
68,Café New York,Restaurant, 4.2 stars ,"44, Dabholkar Building, N S Patkar Marg, Mumbai, Maharashtra 400007","['swiggy.com', 'cafenewyork.in']",084549 44954,Open, ⋅ Closes 12 am
69,Blue Tokai Coffee Roasters | Khar,Cafe, 4.6 stars ,"Plot No 467, Ground Floor, Maya Apartment, Unit No-1, 14th Road, 16th Rd, near Dominos, CHSL, Mumbai, Maharashtra 400052","['swiggy.com', 'zomato.com', 'cafe.bluetokaicoffee.com']",092897 52888,Open, ⋅ Closes 11:30 pm
70,Earthlings' Cafe,Vegan restaurant, 4.5 stars ,"Shop No. 12 Sterlings CHS, Sundervan Complex, Mumbai, Maharashtra 400053",[],088281 11291,Unavailable,Unavailable
71,Third Wave Coffee,Cafe, 4.8 stars ,"Ground floor, Green Ville CHS, opposite Samarth Vaibhav, Lokhandwala Complex, Andheri West, Mumbai, Maharashtra 400053","['thirdwavecoffee.in', 'swiggy.com', 'cafe.thirdwavecoffee.in']",081477 70574,Open, ⋅ Closes 1 am
72,"Grandmama's Cafe, Kemps Corner",Cafe, 4.3 stars ,"1, August Kranti Rd, Gowalia Tank, Tardeo, Mumbai, Maharashtra 400007","['dineout.co.in', 'swiggy.com', 'grandmamascafe.com']",085910 72498,Open, ⋅ Closes 12 am
73,Brooke Bond Taj Mahal Tea House,Tea house, 4.6 stars ,"Sanatan Pereira Bungalow, 36/A, St John Baptist Rd, Bandra West, Mumbai, Maharashtra 400050","['swiggy.com', 'tajmahalteahouse.com', 'tajmahalteahouse.com']",084339 53420,Open, ⋅ Closes 11:30 pm
74,Friends Bench All Day Cafè,Cafe, 4.2 stars ,"1, Chiranjeev, Chittaranjan Rd, Vile Parle East, Mumbai, Maharashtra 400057","['dineout.co.in', 'order.thefriendsbench.com', 'order.thefriendsbench.com']",079001 65846,Open, ⋅ Closes 11 pm
75,Artisan,Lounge, 4.3 stars ,"Sofitel Mumbai Bkc, C 57, G Block BKC, Bandra Kurla Complex, Bandra East, Mumbai, Maharashtra 400051",['sofitel-mumbai-bkc.com'],079001 65846,Unavailable,Unavailable
76,WHITE DECK CAFE,Restaurant, 4.5 stars ,"Nisarg building , shop no 11, Swami Vivekananda Rd, opp. state bank of india, next to Cinemax, Goregaon West, Mumbai, Maharashtra 400062","['dineout.co.in', 'whitedeckcafe.dotpe.in', 'whitedeckcafe.dotpe.in']",098677 71669,Closed, ⋅ Opens 12 pm
77,Tea Villa Café,Tea house, 4.0 stars ,"Hill Rd, opp. Marks & Spencer, Santosh Nagar, Bandra West, Mumbai, Maharashtra 400050",['teavilla.in'],085910 76194,Open, ⋅ Closes 11:30 pm
78,Pondichéry Café - All-day Dining,Buffet restaurant, 4.5 stars ,"Sofitel Mumbai Bkc, C 57, G Block BKC, Bandra Kurla Complex, Bandra East, Mumbai, Maharashtra 400051",['sofitel-mumbai-bkc.com'],085910 76194,Unavailable,Unavailable
79,URBAN STREET CAFE,Cafe, 4.0 stars ,"URBAN STREET CAFE, BHAVYA PLAZA, NEAR STATION KHAR, 1st Rd, Ram Krishna Nagar, Khar West, Mumbai, Maharashtra 400052","['dineout.co.in', 'urbanstreetcafe.com']",098213 18781,Open, ⋅ Closes 4 am
80,"Poetry by Love and Cheesecake, Bandra W",Breakfast restaurant, 4.3 stars ,"Shop 6, Ground Floor, Pali Darshan, 33rd Rd, opp. Mini Punjab, Khar West, Mumbai, Maharashtra 400052","['dineout.co.in', 'swiggy.com', 'zomato.com', 'loveandcheesecake.com']",082912 95412,Open, ⋅ Closes 11:30 pm
81,2 Amigos Snooker & Pool Cafe,Cafe, 4.7 stars ,"Wallace St, Azad Maidan, Fort, Mumbai, Maharashtra 400012",[],082912 95412,Open, ⋅ Closes 12 am
82,Opa! Bar & Cafe,Bar, 4.2 stars ,"Sakinaka Junction Hotel Peninsula Grand, Lokmanya Tilak Nagar, Andheri East, Mumbai, Maharashtra 400072","['swiggy.com', 'bars-pubs.socialgoat.in', 'peninsulagrand.com']",086898 01268,Closed, ⋅ Opens 5 pm
83,Cafe Mysore,South Indian restaurant, 4.2 stars ,"Durlabh Niwas, 1/461, Dr Baba Saheb Ambedkar Rd, Opp B.N. Maheshwari Udyan, Matunga East, Mumbai, Maharashtra 400019",['cafemysore.com'],086898 01268,Open, ⋅ Closes 10 pm
84,Grandmama's All Day Cafe,Cafe, 4.3 stars ,"Ground Floor, Sunny Estate, Sion - Trombay Rd, Chembur, Mumbai, Maharashtra 400071",['grandmamascafe.com'],074000 92994,Closed, ⋅ Opens 12 pm
85,Springold The Luxury Cafe,Cafe, 4.2 stars ,"Shop No 3,4,6 Ground flr, Empire Building, Veera Desai Rd, inside Andheri Cha Raja gate, Mhada Colony, Azad Nagar, Andheri West, Mumbai, Maharashtra 400053","['swiggy.com', 'springoldcafe.com', 'springoldcafe.com']",091527 15608,Open, ⋅ Closes 11 pm
86,"Tea Villa Café, Charni Road",Cafe, 4.1 stars ,"Shop No. 1, North Side, Ground Floor, Back Bay View Building 3 A New Queens Road, Opposite, Charni Road, Station East, Mumbai, Maharashtra 400004",[],093267 64647,Open, ⋅ Closes 11:30 pm
87,Roots Cafe,Coffee shop, 4.1 stars ,"Airport Rd, Bori Colony, Marol, Andheri East, Mumbai, Maharashtra 400059","['dineout.co.in', 'swiggy.com', 'peninsularedpine.in']",098206 45845,Closed, ⋅ Opens 12 pm
88,Lobby Lounge,Lounge, 4.6 stars ,"Grand Hyatt Mumbai Hotel and Residences Bandra Kurla Complex Vicinity, Off, Western Express Hwy, Santacruz East, Mumbai, Maharashtra 400055","['hyattrestaurants.com', 'mumbai.grand.hyatt.com']",098206 45845,Open, ⋅ Closes 8 pm
89,Cafe Delhi Heights,Cafe, 4.3 stars ,"Unit S, 21, Lal Bahadur Shastri Rd, Kamani, Kurla West, Kurla, Mumbai, Maharashtra 400070",[],098195 84033,Closed, ⋅ Opens 12 pm
90,Grandmama's Cafe - Ghatkopar,Cafe, 4.2 stars ,"R City Mall, Ground Floor, Courtyard, Ghatkopar West, Mumbai, Maharashtra 400086",['grandmamascafe.com'],085910 64701,Closed, ⋅ Opens 12 pm
91,Cafe Zebro,Cafe, 4.2 stars ,"Apartments, Aloysius Soares Marg, opp. Diamond Garden, behind Barista, Dreamland Society, Borla, Union Park, Chembur, Mumbai, Maharashtra 400071",['zomato.com'],080559 99222,Unavailable,Unavailable
92,THE COFFEE DEN,Cafe, 5.0 stars ,"78 VITHALWADI NAVINCHANDRA BLDG 1ST FLOOR ROOM NO 6,7, 8, Mumbai, Maharashtra 400002","['dineout.co.in', 'swiggy.com', 'instagram.com']",098199 14865,Open, ⋅ Closes 8 pm
93,Teayo Cafe,Cafe, 4.9 stars ,"Teayo Foodtruck near Infinity backroad Paradigm B, Mindspace, Mumbai, Maharashtra 400064",[],098199 14865,Closed, ⋅ Opens 4:30 pm
94,"Yogisattva Cafe (Plant Based, Gluten Free, Healthy & Farm to Fork)",Cafe, 4.6 stars ,"7th Floor, Pinnacle House 15th Road, Khar Pali Rd, next to Pawan Heightz, Mumbai, Maharashtra 400050","['swiggy.com', 'yogisattva.com']",098674 55009,Open, ⋅ Closes 11 pm
95,Build Your Own Breakfast Cafe (BYOB),Cafe, 4.8 stars ,"Shop 107 A, Dr Ambedkar Rd, next to State Bank of India, Mumbai, Maharashtra 400050",[],098674 55009,Closed, ⋅ Opens 3 pm
96,La Cane Bistro,Cafe, 4.4 stars ,"Shop no 2, Parmar CHS buildig, Paranjpe scheme B, road no 1, off, Hanuman Rd, next to Natural Icecream, Vile Parle East, Mumbai, Maharashtra 400057",['swiggy.com'],093726 21117,Open, ⋅ Closes 11 pm
97,Dinshaw’s Xpress Cafe,Cafe, 4.1 stars ,"Shop No.6, Windermere, New Link Rd, off Oshiwara, Mhada Colony, Andheri West, Mumbai, Maharashtra 400053",['swiggy.com'],090045 30507,Open, ⋅ Closes 12 am
98,Desire instant chai,Coffee shop, 4.4 stars ,"D.N.Nagar, Andheri West, Mumbai, Maharashtra 400053","['swiggy.com', 'desireinstantchai.com']",098673 59830,Open, ⋅ Closes 10 pm
99,Cafe sultan,Fast food restaurant, 4.7 stars ,"cafe sultan,shop no.7,kalina jama masjid,kolivery village road, Kalina, Santacruz East, Mumbai, Maharashtra 400098","['swiggy.com', 'zomato.com', 'zomato.com']",075063 34455,Closed, ⋅ Opens 12 pm
100,TBHC -The Buddies Huddle Cafe,Vegetarian cafe and deli, 4.2 stars ,"Shop No. 5, Ameya House CHSL, Mumbai, Maharashtra 400058","['dineout.co.in', 'tbhc.dotpe.in', 'tbhc.dotpe.in']",098206 76790,Open, ⋅ Closes 12 am
101,Pishu's Cafe,Cafe, 4.3 stars ,"Shop No-8 ,New Shantivan Building,SAB TV Lane, Andheri West, SAB TV Rd, Mumbai, Maharashtra 400053",['swiggy.com'],098333 82021,Open, ⋅ Closes 1:04 am
102,The Bagel Shop,Cafe, 4.2 stars ,"30, Pali Mala Rd, Pali Hill, Mumbai, Maharashtra 400050",['swiggy.com'],098333 82021,Open, ⋅ Closes 10:30 pm
103,145 Kala Ghoda,Cafe, 4.4 stars ,"Temple Bar Building, 145, Mahatma Gandhi Road, Kala Ghoda, Fort, Mumbai, Maharashtra 400001","['eazydiner.com', 'swiggy.com', 'swiggy.com', '145cafeandbar.com']",098333 82021,Closed, ⋅ Opens 12 pm
104,Cafe Marina,Cafe, 4.0 stars ,"सी पैलेस होटल, 26, PJ Ramchandani Marg, Apollo Bandar, Colaba, Mumbai, Maharashtra 400001",['seapalacehotel.net'],098333 82021,Closed, ⋅ Opens 4 pm
105,Cafe Free India,Cafe, 4.2 stars ,"39/41, Ground Floor, 400013, NM Joshi Marg, opposite Deepak Cinema, Lower Parel West, Mumbai, Maharashtra 400013","['dineout.co.in', 'swiggy.com']",090227 80909,Closed, ⋅ Opens 12 pm
106,Chaayos Cafe Phoenix Marketcity Kurla,Cafe, 4.0 stars ,"Unit F, 43, Lal Bahadur Shastri Rd, Kamani, Ashok Nagar, Kurla, Mumbai, Maharashtra 400070","['eazydiner.com', 'chaayos.org']",090227 80909,Open, ⋅ Closes 11 pm
107,The Kettlery Tea Bar & Kitchen | Specialty Tea Boutique (Mumbai),Tea house, 4.4 stars ,"1, 2nd Floor, Horizon, 37 Juhu Beach, Juhu, Mumbai, Maharashtra 400049","['zomato.com', 'thekettlery.com']",090227 80909,Open, ⋅ Closes 12 am
108,Farzi Cafe,Modern Indian restaurant, 4.2 stars ,"Unit No. C-10B, Ground floor, Courtyard, High Street Phoenix, 462, Tulsi Pipe Rd, Lower Parel, Mumbai, Maharashtra 400050",['farzicafe.com'],074000 66824,Closed, ⋅ Opens 12 pm
109,Tea Villa Cafe Juhu,Cafe, 4.1 stars ,"Amar Mahal, Acharya Donde Marg, near Iskcon Temple, Jukarwadi, Juhu, Mumbai, Maharashtra 400049","['dineout.co.in', 'teavilla.in']",080808 50000,Open, ⋅ Closes 12 am
110,Elementaria Bakery Cafe,Cafe, 4.1 stars ,"Tian Building, Gulmohar Rd, JVPD Scheme, Juhu, Mumbai, Maharashtra 400058",['swiggy.com'],074003 84433,Open, ⋅ Closes 2 am
111,Grounded Cafe,Cafe, 4.1 stars ,"Shop no.1, Natalwala Bungalow, 41, BJ Road, Mount Mary, Bandra West, Mumbai, Maharashtra 400050",['instagram.com'],074003 84433,Open, ⋅ Closes 12 am
112,Silver Beach Cafe,Cafe, 4.2 stars ,"3/Plot, F-70, New Link Rd, near Laxmi Industrial Estate, Lokhandwala Complex, Andhe, Mumbai, Maharashtra 400053","['dineout.co.in', 'swiggy.com', 'zomato.com']",077108 82184,Open, ⋅ Closes 12:30 am
113,Cafe Sagar,Cafe, 4.4 stars ,"Nagpada Junction, Corner of, Bellasis Rd, Mumbai Central, Mumbai, Maharashtra 400008",[],077108 82184,Unavailable,Unavailable
114,The Street Cafe,Restaurant, 4.8 stars ,"4VFH+WRQ, Santacruz Electronic Export Processing Zone, Andheri East, Mumbai, Maharashtra 400047",[],077108 82184,Open, ⋅ Closes 11 pm
115,Second Home Cafe,Cafe, 4.4 stars ,"Shop No. 1&2, Marve Rd, Kishan Kunj, Adarsh Nagar, Malad West, Mumbai, Maharashtra 400064","['zomato.com', 'link.zomato.com', 'link.zomato.com']",077388 82628,Open, ⋅ Closes 11:30 pm
116,Café Coffee Day,Cafe, 4.2 stars ,"Ground Floor, Dev Chaaya CHS Ltd Opposite Sobo Central, Haji Ali, South Mumbai, Maharashtra 400034","['cafecoffeeday.com', 'cafecoffeeday.com']",077388 82628,Open, ⋅ Closes 12:55 am
117,Chaos Control Cafe,Cafe, 4.4 stars ,"Sobo Central Mall, Mumbai, Maharashtra 400034","['dineout.co.in', 'swiggy.com']",098190 01682,Open, ⋅ Closes 12:30 am
118,Blue Tokai Coffee Roasters | Versova,Cafe, 4.3 stars ,"Shop Number 6, JP Rd, opposite Palm Beach Apartment, Aram Nagar Part 1, Aram Nagar, Versova, Andheri West, Mumbai, Maharashtra 400061","['eazydiner.com', 'swiggy.com', 'zomato.com', 'cafe.bluetokaicoffee.com']",081049 89927,Open, ⋅ Closes 11:30 pm
119,Cafe Holiday Versova,Cafe, 4.3 stars ,"7/11, Meera Apts, Juhu Versova Link Rd, opp. Versova Social, Seven Bunglow, Andheri West, Mumbai, Maharashtra 400053","['eazydiner.com', 'swiggy.com', 'instagram.com']",091520 15212,Closed, ⋅ Opens 12 pm
