,Name,Type,Image Link,Discription,Link
58,Cathedral of the Holy Name,['Religious'],//imgak.mmtcdn.com/seo/travel-guide/media/image/master/not_available_icon.jpg," Cathedral of the Holy Name is a celebrated shrine that is highly regarded by the Christian community in Mumbai. Situated in the prominent commercial centre of Colaba, it stands as a reminder of the colonial era. The foundation stone of the building was laid on 9th July 1902 while it ... ", //www.makemytrip.com/travel-guide/mumbai/cathedral-of-the-holy-name-religious.html 
59,Central Chinmaya Mission Trust,"['Religious', ' Cultural']",//imgak.mmtcdn.com/seo/travel-guide/media/image/master/not_available_icon.jpg,, //www.makemytrip.com/travel-guide/mumbai/central-chinmaya-mission-trust-cultural.html 
60,Dharavi,['Landmark'],//www.makemytrip.com/travel-guide/media/dg_image/mumbai/thumb/Daharavi_Mumbai_417415_211_mumbai_218_168.jpg," Some would find it quite ironic that Mumbai, the capital of Maharashtra and often called India’s financial capital, is home to one of the largest slums in the world. The area is known as Dharavi, which in many ways sum up the extreme paradoxes that exist in India. There is ... ", //www.makemytrip.com/travel-guide/mumbai/dharavi-landmarks.html 
61,Haji Ali Dargah,"['Religious', ' Landmark']",//www.makemytrip.com/travel-guide/media/dg_image/mumbai/thumb/Haji-Ali-Dargah_417416_211_mumbai_218_168.jpg," Haji Ali Dargah is a celebrated Islamic shrine, which earns immense recognition across the globe. This white edifice is nestled on a small islet that lies away from the city's shoreline, almost in the middle of the Arabian Sea. The reason behind the popularity and prominence of this religious complex ... ", //www.makemytrip.com/travel-guide/mumbai/haji-ali-dargah-religious.html 
62,Hedavde Mahalaxmi Temple,['Religious'],//imgak.mmtcdn.com/seo/travel-guide/media/image/master/not_available_icon.jpg," Param Pujya Guruvarya Dadasaheb Hate Om Shree Maha Laxmi Mata Mandir Trust owns Hedavde Mahalaxmi Temple. The temple, situated in Hedavde village near Vasai, forms an important part of a famous Shakti Peetha. The Shakti Peetha to which this temple belongs is the one where Goddess Sati's ankle fell during ... ", //www.makemytrip.com/travel-guide/mumbai/hedavde-mahalaxmi-temple-religious.html 
63,ISKCON Temple Mumbai,['Religious'],//www.makemytrip.com/travel-guide/media/dg_image/mumbai/thumb/ISKCON-Temple_Mumbai_417422_211_mumbai_218_168.jpg, ISKCON Temple Mumbai is built over four acres of land in Juhu. The foundation of this shrine was laid by A.C. Bhaktivedanta Swami Prabhupada during the 1970s. The main deity of the temple is Sri Sri Radha Rasabihari (Lord Krishna). Sri Sri Gaura-Nitai and Sri Sri Sita Rama Laxman Hanuman ... , //www.makemytrip.com/travel-guide/mumbai/iskcon-temple-mumbai-religious.html 
64,Jain Temple Mumbai,['Religious'],//www.makemytrip.com/travel-guide/media/dg_image/mumbai/thumb/Jain-Temple_417423_211_mumbai_218_168.jpg," Jain Temple Mumbai, also known as Babu Amichand Panalal Adishwarji Jain Temple, is a popular place of religious significance. Located in Walkeshwar area, this shrine is dedicated to Adishwara – the founder of Jainism. It was built more than 100 years ago in 1904 and is larger than most of ... ", //www.makemytrip.com/travel-guide/mumbai/jain-temple-mumbai-religious.html 
65,Kanheri Caves,"['Religious', ' Cultural']",//www.makemytrip.com/travel-guide/media/dg_image/mumbai/thumb/Kanheri-Caves_Mumbai_417424_211_mumbai_218_168.jpg," A fascinating cluster of rock-cut monuments, Kanheri Caves is situated deep inside the famous Sanjay Gandhi National Park. These caves date back to the ancient times (3rd century BC to 11th century AD), and are believed to be the country's oldest and largest cave formations in a single hill. This ... ", //www.makemytrip.com/travel-guide/mumbai/kanheri-caves-religious.html 
66,Madh Fort,['Monument'],//imgak.mmtcdn.com/seo/travel-guide/media/image/master/not_available_icon.jpg," The Portuguese built Madh Fort, or Versova Fort, as a watchtower during the 17th century. However, the Portuguese lost this fort to the Marathas in the 1739 war. It stands proudly on the Madh Island, close to the Aksa Beach in Mumbai. Communities of local fishermen presently inhabit the area ... ", //www.makemytrip.com/travel-guide/mumbai/madh-fort-monuments.html 
67,Mumbai Zoo (Veermata Jijabai Udyan),['Zoo/Aquarium'],//www.makemytrip.com/travel-guide/media/dg_image/mumbai/thumb/Mumbai-Zoo_417429_211_mumbai_218_168.jpg,, //www.makemytrip.com/travel-guide/mumbai/mumbai-zoo-veermata-jijabai-udyan-zoo-and-aquariums.html 
68,Narmadeshwar Mahadev Mandir,['Religious'],//imgak.mmtcdn.com/seo/travel-guide/media/image/master/not_available_icon.jpg," Lord Shiva, the Parameshwara or The Supreme God, is the main deity of the Narmadeshwar Mahadev Mandir in Mumbai. The temple houses a unique form of the deity known as Bana Lingam, which was obtained from the River Narmada. This Hindu shrine made of white marble is elegantly decorated with ... ", //www.makemytrip.com/travel-guide/mumbai/narmadeshwar-mahadev-mandir-religious.html 
69,Nehru Planetarium,"['Museum', ' For Kids']",//www.makemytrip.com/travel-guide/media/dg_image/mumbai/thumb/Nehru-Planetarium_Mumbai_417431_211_mumbai_218_168.jpg," Nehru Planetarium, a part of the famous Nehru Centre, was inaugurated on 3rd March 1977 by the former Prime Minister of India - Indira Gandhi. It features a Digistar 3 projector, which was installed around a decade ago, in the year 2003. Over the decades, the planetarium has grown into ... ", //www.makemytrip.com/travel-guide/mumbai/nehru-planetarium-museum.html 
70,Rajabai Clock Tower,['Landmark'],//imgak.mmtcdn.com/seo/travel-guide/media/image/master/not_available_icon.jpg," Rajabai Clock Tower is situated within the compound of Fort Campus in the University of Mumbai. Sir Gilbert Scott designed the structure of the tower, which bears resemblance to London’s Clock Tower – Big Ben. Its foundation stone was laid in the year 1869 and has been named after Premchand ... ", //www.makemytrip.com/travel-guide/mumbai/rajabai-clock-tower-landmarks.html 
71,Shree Balaji Mandir,['Religious'],//imgak.mmtcdn.com/seo/travel-guide/media/image/master/not_available_icon.jpg," Shree Balaji Mandir is a popular shrine dedicated to Lord Balaji, who is also known as God Venkateswara (a form of Hindu deity Vishnu). Shree Balaji Foundation, a registered Charitable Public Trust, manages this religious site. Located at Charkop in Mumbai, the shrine is thronged by pilgrims all around the ... ", //www.makemytrip.com/travel-guide/mumbai/shree-balaji-mandir-religious.html 
72,St. Thomas Cathedral,['Religious'],//www.makemytrip.com/travel-guide/media/dg_image/mumbai/thumb/St-Thomas-Cathedral_417440_211_mumbai_218_168.jpg," St. Thomas Cathedral earns fame as the first Anglican church of erstwhile Bombay. It is a glorious testament of the several hundred years, during which the city stayed under the reign of the British East India Company. Named after Saint Thomas, one of the 12 apostles of Jesus Christ, this ... ", //www.makemytrip.com/travel-guide/mumbai/st-thomas-cathedral-religious.html 
73,Taraporewala Aquarium,['Zoo/Aquarium'],//imgak.mmtcdn.com/seo/travel-guide/media/image/master/not_available_icon.jpg," Taraporewala Aquarium, built in the year 1951, boasts of rich aquatic life. Dr. Rajendra Prasad, the first President of India, did the formal opening of this aquarium. It has been named after the Parsee man who donated around Rs. 200000 for the construction of this aquarium. On display are more ... ", //www.makemytrip.com/travel-guide/mumbai/taraporewala-aquarium-zoo-and-aquariums.html 
74,Tower of Silence,['Landmark'],//www.makemytrip.com/travel-guide/media/dg_image/mumbai/thumb/Tower-of-silence_417445_211_mumbai_218_168.jpg," The Tower of Silence, also known as Parsee Bawdi, is a sprawling graveyard that is situated in the posh Malabar Hill region of the city. Covering an area of 55 acres, this funeral ground is where the last rites of people belonging to the Parsee community are performed. ... ", //www.makemytrip.com/travel-guide/mumbai/tower-of-silence-landmarks.html 
75,Town Hall Asiatic Society Library,['Landmark'],//www.makemytrip.com/travel-guide/media/dg_image/mumbai/thumb/Town-Hall-Asiatic-Society-Library_Mumbai_417446_211_mumbai_218_168.jpg," Overlooking the famous Horniman Circle Gardens in Mumbai's Fort area, Town Hall is one of the living reminders of Victorian Bombay. This colonial building was constructed in 1833 with funds from the Literary Society of Bombay and central government. Presently known as the Asiatic Society of Bombay, this learned group ... ", //www.makemytrip.com/travel-guide/mumbai/town-hall-asiatic-society-library-landmarks.html 
76,Walkeshwar Temple,['Religious'],//imgak.mmtcdn.com/seo/travel-guide/media/image/master/not_available_icon.jpg," Walkeshwar Temple, also known as the Banganga Temple, is an esteemed place of worship for Hindus. Lord Shiva is the prime deity of this temple, which lies in the South Mumbai region of the metropolis. As per legends, Lord Rama stopped here, while going to Lanka on His search for ... ", //www.makemytrip.com/travel-guide/mumbai/walkeshwar-temple-religious.html 
77,Asia Society,['Cultural'],//imgak.mmtcdn.com/seo/travel-guide/media/image/master/not_available_icon.jpg, Asia Society in Mumbai is a premier educational organisation and cultural centre dedicated towards the promotion and expression of creative ideas. It is affiliated to the acclaimed Asia Society of New York which was founded in 1956 and has international presence across several nations. It aims at forming strong bonds ... , //www.makemytrip.com/travel-guide/mumbai/asia-society-cultural.html 
78,Babington Point,['Landmark'],//imgak.mmtcdn.com/seo/travel-guide/media/image/master/not_available_icon.jpg," Located at an elevation of 1294 metres above the sea level, Babington Point is a beautiful viewpoint on Tapola Road. Just 2.5 kilometres away from the main market, this site is easily accessible from any part of the hill station. The path leading to this enchanting destination is itself quite ... ", //www.makemytrip.com/travel-guide/mumbai/babington-point-landmarks.html 
79,Colaba,['Landmark'],//www.makemytrip.com/travel-guide/media/dg_image/mumbai/thumb/Colaba_mumbai_417453_211_mumbai_218_168.jpg," Sprawling in Mumbai's southernmost peninsula, Colaba is a bustling district that is packed with heritage sites, street stalls, markets, restaurants, bars and assorted accommodation choices. Under Portuguese rule during the 16th century, this area was known as Candil. Later, when the British arrived, they renamed it as Colio. The current ... ", //www.makemytrip.com/travel-guide/mumbai/colaba-landmarks.html 
80,Indian Museum Ship Vikrant,['Museum'],//imgak.mmtcdn.com/seo/travel-guide/media/image/master/not_available_icon.jpg," Indian Museum Ship Vikrant is an aircraft carrier that was opened as a public museum during the Navy Week celebrations of 2012. Assembled in 1945 and purchased in 1957 by the Indian Navy, INS Vikrant is presently docked near the Gateway of India. It served the country during the Indo-Pak ... ", //www.makemytrip.com/travel-guide/mumbai/indian-museum-ship-vikrant-museum.html 
81,Mahalakshmi Temple,['Religious'],//imgak.mmtcdn.com/seo/travel-guide/media/image/master/not_available_icon.jpg,, //www.makemytrip.com/travel-guide/mumbai/mahalakshmi-temple-religious.html 
82,St. George Fort,['Monument'],//imgak.mmtcdn.com/seo/travel-guide/media/image/master/not_available_icon.jpg," St. George Fort or Fort George is a crumbled structure that stands in the Fort area of Mumbai. Named in praise of King George III, the fort reminds of the British empire's early days in India. It was built in 1769 at the site of the Dongri Fort, as an ... ", //www.makemytrip.com/travel-guide/mumbai/st-george-fort-monuments.html 
83,Konkan,['Places to see around'],//www.makemytrip.com/travel-guide/media/dg_image/mumbai/thumb/Konkan_Mumbai_417464_211_mumbai_218_168.jpg," Encompassing six coastal districts within its geographical territory, Konkan division forms an integral part of Maharashtra. Mumbai, Mumbai Suburbs, Sindhudurg, Raigad, Thane and Ratnagiri are the six districts that form this sprawling coastal belt. Bordering the western shore of the country, this region is replete with a plethora of natural ... ", //www.makemytrip.com/travel-guide/mumbai/konkan-places-to-see-around.html 
84,Alibag,['Places to see around'],//www.makemytrip.com/travel-guide/media/dg_image/mumbai/thumb/Alibaugh_mumbai_417467_211_mumbai_218_168.jpg,, //www.makemytrip.com/travel-guide/mumbai/alibag-places-to-see-around.html 
85,Jehangir Art Gallery,['Cultural'],//www.makemytrip.com/travel-guide/media/dg_image/mumbai/thumb/Jehangir-Art-Gallery_mumbai_417468_211_mumbai_218_168.jpg,, //www.makemytrip.com/travel-guide/mumbai/jehangir-art-gallery-cultural.html 
